"","AID","row.names","PT","BA","BE","Z2","Y1","AE","Z3","BS","VL","MA","BP","EP","AR","SU","PD","AK","CT","CY","SP","CL"
"1","A001","J","Abdollahi, Z; Gomes, VG","","","Synthesis and characterization of polyacrylamide with controlled molar weight","","","ResearchGate","","","1","7","","","",2011,"","","","",1
"2","A002","J","Agrawal, M.; Mishra, P.","","","A Comparative Survey on Symmetric Key Encryption Techniques","","","ResearchGate","4","5","","","","","May",2012,"","","","",2
"3","A003","J","Akilla, B.; Manickavasakam, K.","","","Anatomical studies on the seeds of Alternanthera sessilis Linn","","","ResearchGate","","","","","","","",2014,"","","","",1
"4","A004","J","Alexander, A. L.; Brunye, T.; Sidman, J.; Weil, S. A.","","","From Gaming to Training: A Review of Studies on Fidelity, Immersion, Presence, and Buy-in and Their Effects on Transfer in PC-Based Simulations and Games","","","ResearchGate","","","","","","","Jan",2005,"","","","",1
"5","A005","J","Allis, D. G.; Korter, T. M.","","","Development of Computational Methodologies for the Prediction and Analysis of Solid-State Terahertz Spectra, 2","","","ResearchGate","17","","193","212","","","",2007,"","","","",1
"6","A006","J","Amrollahi, A.","","","A Process Model for Crowdsourcing: Insights from the Literature on Implementation","","","Research Gate","","","","","","","",2016,"","","","",1
"7","A007","J","Arbizu, PM","","","","","","How can I do PerMANOVA pairwise contrasts in R? ResearchGate","","","","","","","Jan 30",2016,"","","","",1
"8","A008","J","Polovodova Asteman, I. R.; Schonfeld, J.","","","Recent invasion of the foraminifer Nonionella stella Cushman & Moyer, 1930 in northern European waters: evidence from the Skagerrak and its Fjords","","","ResearchGate","35","1","","","","","",2015,"","","","",1
"9","A009","J","Aubry, S.; Andre, G.","","","","","","ResearchGate","3","","","","","","Jan.",1980,"","","","",1
"10","A010","J","Aucoin, M.; Fry, M.","","","Growing local food movements: Farmers' markets as nodes for products and community","","","ResearchGate","56","","61","78","","","",2015,"","","","",1
"11","A011","J","Auerswald, K.; Hafner, B.D.; Konig, A.","","","Data of Hoof growth rates of the European roe deer (Capreolus capreolus) for dating the hoof's isotopic archive published in Forests","","","ResearchGate","","","","","","DOI 10.13140/RG.2.2.21031.85925","",2017,"","","","",1
"12","A012","J","Avallone, S.; Guadagno, S.; Emma, D.; Pescape, A.; Ventre, G.","","","DITG Distributed Internet Traffic Generator","","","ResearchGate","","","316","317","","","",2004,"","","","",1
"13","A013","J","Backfrieder, C.; Ostermayer, G.; Mecklenbrauker, C. F.","","","TraffSim - A traffic simulator for investigations of congestion minimization through dynamic vehicle rerouting","","","ResearchGate","15","4","38","47","","","Aug.",2014,"","","","",2
"14","A014","J","Bako-Biro, Z.; Kochhar, N.; Clements-Croome, D.J.; Awbi, H.B.; Willianis, M.","","","Ventilation Rates in Schools and Learning Performance","","","ResearchGate","","","","","","","",2007,"","","","",1
"15","A015","J","Zhan, Jianfeng","","","","","","Big Data Benchmarks, Performance Optimization, and Emerging Hardware: 4th and 5th Workshops","","","","","","","",2014,"","","","",1
"16","A016","J","Bandyopadhyay, A. K.","","","Generalized Thevenins ' theorem and its proof","","","ResearchGate","","","","","","10.13140/RG.2.1.3332.5605","Apr. 24",2015,"","","","",1
"17","A017","J","Bartram, J.","","","Water quality: guidelines, standards, and health: assessment of risk and risk management for water-related infectious disease","","","ResearchGate","","","","","","","",2001,"","","","",1
"18","A018","J","Basam, Venkata R; Ravi Kumar, G","","","","","","Evolutionary Approach Based Design of BLDC Motor controller with H8 Objectives","","","","","","","",2010,"","","","",1
"19","A019","J","Basawapatna, A. R.; Repenning, A.; Lewis, C. H.","","","The simulation creation toolkit: An initial exploration into making programming accessible while preserving computational thinking","","","ResearchGate","","","501","506","","","",2013,"","","","",1
"20","A020","J","Basrah, J.","","","Vibration Analysis and Diagnostic Guide","","","ResearchGate","","","","","","","December",2016,"","","","",1
"21","A021","J","Bastian, M.; Heymann, S.; Jacomy, M.","","","Gephi: An Open Source Software for Exploring and Manipulating Networks","","","ResearchGate","","","","","","","",NA,"","","","",1
"22","A022","J","Bentaha, M. L.; Dolgui, A.; Battaia, O.","","","Problem Instances I Have Used in the Numerical Experiments of My Work on Disassembly Line Design and Balancing under Uncertainty","","","Researchgate","1","","1","14","","DOI 10.13140/RG.2.1.5163.5043","",2015,"","","","",1
"23","A023","J","Bhagawati, A.; Chutia, R.","","","Design of Single Channel Portable EEG Signal Acquisition System for Brain Computer Interface Application","","","ResearchGate","","","","","","","",2016,"","","","",1
"24","A024","J","Bhattacharyya, A. S.; Gaurav, K.; Kommu, P. Y.","","","","","","Researchgate","","","","","","10.13140/RG.2.1.5077.8082","",2015,"","","","",1
"25","A025","J","Bhavanani, AB","","","Yoga for health in children","","","ResearchGate","","","","","","","",2007,"","","","",1
"26","A026","J","Binol, H.; Uslu, F.; Bal, A.","","","Unsupervised Nonlinear Feature Extraction Method And Its Effects On Target Detection In High-Dimensional Data","","","ResearchGate","","","","","","","",2015,"","","","",1
"27","A027","J","Bishop, A.; Henkel, D. J.","","","The Measurement of Soil Properties in the Triaxial Test","","","ResearchGate","","","","","","","Jan.",1957,"","","","",1
"28","A028","J","Bobadila, R.; Berr, A.","","","Histone Methylation-A corertone for plant responses to environmental stresses?","","","ResearchGate","","","31","61","","","",2016,"","","","",1
"29","A029","J","Boehm, B. W.","","","Some Future Software Engineering Opportunities and Challenges","","","ResearchGate","","","1","32","","","",2010,"","","","",1
"30","A030","J","Bollen, K. A.; Jackman, R. W.","","","Regression diagnos-tics: an expository treatment of outliers and influential cases","","","ResearchGate","13","","510","542","","","",1990,"","","","",1
"31","A031","J","Boyd, Danah","","","Social Network Sites as Networked Publics: Affordances, Dynamics, and Implications","","","ResearchGate","","","","","","","",2010,"","","","",3
"32","A032","J","BRADBURY IR","","","","","","RESEARCHGATE","340","","245","","","","",2007,"","","","",1
"33","A033","J","Brocca, L.; Ciabatta, L.; Massari, C.; Hahn, S.; Wagner, W.","","","SM2RAIN-ASCAT (1 Jan 2007-30 June 2015) global daily rainfall dataset","","","ResearchGate","","","","","","10.13140/RG.2.1.4434.8563","",2016,"","","","",1
"34","A034","J","Brunick, KL; Cutting, JE","","","Coloring the animated world, Exploring human color perception and preference through the animated film","","","ResearchGate","43","2","41","45","","","",2016,"","","","",1
"35","A035","J","Camara, F.; Hormigo, T.","","","A Hybrid Camera-Lidar Hazard Detection and Avoidance System for Lunar Landing","","","ResearchGate","","","","","","","",2011,"","","","",1
"36","A036","J","Cameron, G.","","","Innovation and Growth: A Survey of the Empirical Evidence","","","ResearchGate","","","","","","","Jan.",1998,"","","","",1
"37","A037","J","CAMPUZANO, R.","","","Evaluacion del periodo de espera voluntario en vacas especializadas en produccion de leche","","","ResearchGate","","","","","","","",2007,"","","","",1
"38","A038","J","Champlain, A. F. D.; Gessaroli, M. E.; Tang, K. L.; Champlain, J. E. D.","","","Assessing the dimensionality of polytomous item responses with small sample sizes and short test lengths: A comparison of procedures","","","ResearchGate","","","","","","","",1999,"","","","",1
"39","A039","J","Chaslot, G; Bakkes, S; Szita, I; Spronck, P","","","Monte-Carlo Tree Search: A New Framework for Game AI","","","ResearchGate","","","","","","","",2008,"","","","",1
"40","A040","J","Chatterjee, N.; Bhattacharjee, B.; Chatterjee, N.","","","Quantitative study on the impact of the seasonal change in the aquatic physicochemical parameters on zooplankton population density in Saheb bandh, Purulia, West Bengal, India","","","ResearchGate","","","11","19","","","",2015,"","","","",1
"41","A041","J","Chen, G. Z.","","","","","","ResearchGate","","","","","","","",2015,"","","","",1
"42","A042","J","Chen, Yen-Liang; Chiang, Mei-Ching; Ko, Ming-Tat","","","Discovering time-interval sequential patterns in sequence databases","","","Researchgate","","","","","","","",2003,"","","","",1
"43","A043","J","Chiad, Sami Salman; Habubi, Nadir Fadhil; Khaleel, Reem Saadi; Abdul Hussein, Obaida Amer","","","","","","Research Gate","","","515","515","","","",2010,"","","","",1
"44","A044","J","Chiejina, E.","","","A Dynamic Reputation Management System for Mobile Adhoc Networks","","","ResearchGate","","","","","","","",2015,"","","","",1
"45","A045","J","Chirani, N.; Yahia, L.; Gritsch, L.; Motta, F.L.; Chirani, S.; Fare, S.","","","History and applications of hydrogels","","","ResearchGate","4","2","13","23","","","Dec 1",2015,"","","","",2
"46","A046","J","Clifford, M. N.","","","","","","Researchgate","","","","","","10.13140/RG.2.2.21311.71848","",2017,"","","","",2
"47","A047","J","Coban, O.; Ozyer, B.; Ozyer, G. T.","","","Sentiment Analysis for Turkish Twitter Feeds","","","ResearchGate","","","","","","","",2015,"","","","",1
"48","A048","J","Crippen, G.; Havel, T. F.","","","","","","ResearchGate","","","","","","","",1988,"","","","",1
"49","A049","J","Dabiri, JO; Gharib, M","","","The role of optimal vortex formation in biological fluid transport","","","ResearchGate","272","1572","1557","1560","","","",NA,"","","","",1
"50","A050","J","Daemen, J.; Rijmen, V.","","","Resistance against implementation attacks A comparative study of the AES proposals","","","ResearchGate","","","","","","","",NA,"","","","",1
"51","A051","J","Dat, L.D.; Thao, N.P.; Luyen, B.T.T.; Tai, B.H.; Jeong, M.H.; Woo, M.H.; Kim, Y.H.","","","Identification of six new lupane-type triterpenoids from Acanthopanax koreanum leaves and their tyrosinase inhibitory activities","","","ResearchGate.","","","","","","","",2015,"","","","",1
"52","A052","J","de Camargo, MBP; Hubbard, KG","","","Drought sensitivity indices for a sorghum crop","","","JOURNAL OF PRODUCTION AGRICULTURE","12","2","312","316","","","APR-JUN 1999",1999,"","","","",5
"53","A053","J","De, R.; Mahapatra, R. P.; Chakraborty, P. S.","","","Exploring and Expanding the World of Artificial Intelligence","","","ResearchGate","","","","","","DOI 10.5120/IJCA2016907802","January",2016,"","","","",1
"54","A054","J","De Bruin, H.; Wang, J.","","","Scintillometry: a review","","","Researchgate","","","","","","","",NA,"","","","",1
"55","A055","J","Dzmbeg-Malcic, V.; Barbaric-Mikocvic, Z.; Itric, K.","","","Kubelka-Munk theory in describing optical properties of paper (I)","","","ResearchGate","19","","191","196","","","",2012,"","","","",1
"56","A056","J","Denfeld, Blaize A.; Wallin, Marcus B.; Sahlee, Erik; Sobek, Sebastian; Kokic, Jovana; Chmiel, Hannah E.; Weyhenmeyer, Gesa A.","","","Temporal and spatial carbon dioxide concentration patterns in a small boreal lake in relation to ice-cover dynamics","","","BOREAL ENVIRONMENT RESEARCH","20","6","679","692","","","DEC 18 2015",2015,"","","","",7
"57","A057","J","Dhall, Abhinav","","","Video And Image Based Emotion Recognition Challenges In The Wild: Emotiw 2015.","","","ResearchGate","","","","","","","",2015,"","","","",1
"58","A058","J","Dheeba, J.; Singh, N. Albert","","","Computer Aided Intelligent Breast Cancer Detection: Second Opinion for Radiologists-A Prospective Study","","","Studies in Computational Intelligence","575","","397","430","","10.1007/978-3-319-11017-2_16","2015",2015,"","","","",3
"59","A059","J","Dijkstra, T. K","","","Consistent partial least squares estimators for linear and polynomial factor models. A report of a belated, serious and not even unsuccessful attempt","","","ResearchGate","","","","","","10.13140/RG.2.1.3997.0405","",2011,"","","","",2
"60","A060","J","Dookhitram, K.; Narsoo, J.; Sunhaloo, M. S.; Sukhoo, A.; Soobron, M.","","","Green Computing: An Awareness Survey among University of Technology, Mauritius Students","","","ResearchGate","","","1","8","","","",2012,"","","","",1
"61","A061","J","Durazo, B. E.; Chavez, C. B. H.; Gonzalez, P. M. E.; Nava, G. B.","","","Estudio descriptivo sobre el consumo de pescados y mariscos en una muestra de la comunidad universitaria en Ensenada, Mexico","","","Researchgate","","11","1","19","","","",2013,"","","","",1
"62","A062","J","Fabritsiev, S. A.; Pokrovsky, A. S.; Bagautdinov, R. M.","","","Neutron irradiation effect on the mechanical properties and structure of beryllium","","","ResearchGate","","","1062","1076","","","",1999,"","","","",1
"63","A063","J","Fan, J.; Han, F.; Liu, H.","","","Challenges of Big Data Analysis.","","","ResearchGate","1","1","1","38","","","",2013,"","","","",1
"64","A064","J","Feizizadeh, B.; Blaschke, T.","","","Examining urban heat island relations to land use and air pollution: multiple endmember spectral mixture analysis for thermal remote sensing","","","Researchgate","3","6","1","8","","","",2013,"","","","",1
"65","A065","J","Fernandez-Ruiz, R.","","","Experimental correlation study of the <SUP>7</SUP>Li and <SUP>93</SUP>Nb MAS-NMR signals versus vacant composition in Lithium Niobate","","","ResearchGate","","","","","","","September",2015,"","","","",1
"66","A066","J","Flann, N.; Xu, B.; Recker, M.; Qi, X.; Ye, L.","","","Clustering Educational Digital Library Usage Data: A Comparison of Latent Class Analysis and K-means Algorithms","","","ResearchGate","5","2","","","","","Aug.",2013,"","","","",1
"67","A067","J","Fotiadis, Dimitrios I; Glaros, Constantine; Likas, Aristidis","","","Wearable Medical Devices","","","ResearchGate","","","3816","3827","","","April",2006,"","","","",1
"68","A068","J","Fourati, S.; Jedidi, W.","","","Some remarks on the class of Bernstein functions and some subclasses","","","ResearchGate Article","","","","","","","",2011,"","","","",1
"69","A069","J","Fukushima, S.; Yamaguchi, M.; Harusawa, F.","","","Effect of cetostearyl alcohol on stabilization of oil-in-water emulsion: II. Relation between crystal form of the alcohol and stability of the emulsion","","","ResearchGate","59","","159","165","","","",1977,"","","","",1
"70","A070","J","Gajsek, B.; Dukic, G.","","","Review of ergonomics solutions to protect from injuries of lower back in case of forklifts.","","","Researchgate","","","","","","","",2015,"","","","",1
"71","A071","J","Galkin, M.; Auer, S.; Scerri, S.","","","Enterprise Knowledge Graphs: A Backbone of Linked Enterprise Data","","","ResearchGate","","","","","","","May",2016,"","","","",1
"72","A072","J","Gelsinger, P.; Kirkpatrick, D.; Kolodny, A.; Singer, G.","","","Coping with the Complexity of Microprocessor Design at Intel-A CAD History","","","Researchgate","","","","","","","",NA,"","","","",1
"73","A073","J","Gener, T.; Reig, R.; Sanchez-Vives, M.V.","","","A new paradigm for the reversible blockage of whisker sensory transmission","","","ResearchGate","176","","63","67","","","",2008,"","","","",1
"74","A074","J","Godin, C.; Prost-Boucle, F.; Campagne, A.; Charbonnier, S.; Bonnet, S.; Vidal, A.","","","Selection of the most relevant physiological features for classifying emotion","","","ResearchGate","","","","","","","",2015,"","","","",4
"75","A075","J","Goodhead, D. T.","","","","","","ResearchGate","","","","","","","",2013,"","","","",1
"76","A076","J","Gordillo, G.; Hurtado, M. F.; becerra, R. A.; Cruz, S. D.; Ramirez, E. A.; Oyola, J. S.; Lauermann, Iver.","","","comparison study of CZTS thin films grown using vacuum and solution based methods","","","ResearchGate","","","1704","1708","","","",2014,"","","","",1
"77","A077","J","Goyal, S. K.; Singh, M.","","","Adaptive and Dynamic Load Balancing in Grid Using Ant Colony Optimization","","","ResearchGate","4","4","","","","","Aug.",2012,"","","","",1
"78","A078","J","Graham, J.; Shillcutt, K.","","","Robot Tracking of Human Subjects in Field Environments","","","ResearchGate","","","","","","","",2003,"","","","",1
"79","A079","J","Grande, Marion; Meffert, Elisabeth; Schoenberger, Eva; Jung, Stefanie; Frauenrath, Tobias; Huber, Walter; Hussmann, Katja; Moormann, Mareike; Heim, Stefan","","","From a concept to a word in a syntactically complete sentence: An fMRI study on spontaneous language production in an overt picture description task","","","NEUROIMAGE","61","3","702","714","","10.1016/j.neuroimage.2012.03.087","JUL 2 2012",2012,"","","","",13
"80","A080","J","Graves, A.","","","Offline handwriting recognition with multidimensional recurrent neural networks","","","ResearchGate","","","","","","","",2008,"","","","",1
"81","A081","J","Gropler, RJ; Peterson, LR","","","Imaging of Myocardial Metabolism","","","ResearchGate.","","","641","56","","","",2010,"","","","",1
"82","A082","J","Guinard, D.; Trifa, V.; Guinard, D.","","","Towards the web of things: web mashups for embedded devices","","","ResearchGate","","","","","","","",2009,"","","","",1
"83","A083","J","Gumbel, E. J.","","","","","","Distributions des Valeurs Extremes en Plusiers Dimensions","","","","","","","",1960,"","","","",1
"84","A084","J","Hafferty, F.; Salloway, J.C.","","","The evolution of medicine as a profession. A 75-year perspective","","","ResearchGate","76","1","26","35","","","",1993,"","","","",1
"85","A085","J","Haklay, Muki; Budhathoki, Nama","","","OpenStreetMap-Overview and Motivational Factors","","","ResearchGate","","","","","","","",NA,"","","","",1
"86","A086","J","Hammer, D; Elby, A; Scherr, RE; Redish, EF","","","Resources, framing, and transfer","","","ResearchGate","","","","","","","",NA,"","","","",1
"87","A087","J","Harbach, RE","","","The mosquitoes of the subgenus culex in southwestern Asia and Egypt (Diptera: culiciclae)","","","ResearchGate","24","","1","240","","","",1988,"","","","",1
"88","A088","J","Hari, R.","","","The neuromagnetic method in the study of the human auditory cortex","","","ResearchGate","6","","","","","","",1990,"","","","",1
"89","A089","J","Hartenstein, R","","","The alternative machine paradigm for energy efficient computing","","","ResearchGate","","","113","113","","10.13140/RG.2.2.19501.49124","",2016,"","","","",1
"90","A090","J","Heldenbrand, SD; Dayer, L; Renna, C","","","Navigating the flooded adherence app marketplace: rating the quality of medication adherence apps","","","ResearchGate","","","","","","","",2015,"","","","",1
"91","A091","J","Hewavitharana, S.; Fernando, H. C.","","","A two stage classification approach to tamil handwriting recognition","","","ResearchGate","","","","","","","Jan.",2009,"","","","",1
"92","A092","J","Hien, H; Berthe, A; Drabo, MK; Meda, N; Konate, B; Tou, F","","","Husavik energy-multiple use of geothermal energy thermie project nr.ge 321/98/is/dk. Htisavik Energy-Multiple use of geothermal energy Thermie project nr. GE 321/98/IS/DK","","","ResearchGate","19","11","1328","33","","","",2003,"","","","",1
"93","A093","J","Hinrichsen, PF","","","Analysis of bi and trifilar suspension oscillations","","","Researchgate","","","64","64","","","",2015,"","","","",1
"94","A094","J","Hinton, G. E.; Srivastava, N.; Krizhevsky, A.; Sutskever, I.; Salakhutdinov, R. R.","","","Improving neural networks by preventing co adaptation of feature detectors","","","ResearchGate","3","4","212","223","","","",2012,"","","","",61
"95","A095","J","Hong, Jang; Rani, Han; Song, Shim","","","Expanded polystyrene (eps) buoy as a possible source of hexabromocyclododecanes (HBCDs) in the marine environment","","","ResearchGate","75","","882","885","","","",2013,"","","","",1
"96","A096","J","Hu, G.; Liu, C.; Liao, Y.; Yang, L; Huang, R.; Wu, J.; Xie, J.; Bundhoo, K.; Liu, Y.; Bin, J.","","","Ultrasound molecular imaging of arterial thrombi with novel microbubbles modified by cyclic RGD in vitro and in vivo","","","ResearchGate","107","","172","183","","","",2011,"","","","",1
"97","A097","J","Huang, Y.L.; Fuh, C.S.","","","Noise reduction using enhanced bilateral filter","","","Researchgate","12","4","46","53","","","",2006,"","","","",1
"98","A098","J","Iftekhar, S.; Srivastava, V.; Sillanpaa, M.","","","Synthesis and application of LDH intercalated cellulose nanocomposite for separation of rare earth elements (REEs)","","","ResearchGate","","","","","","","",2016,"","","","",1
"99","A099","J","Indrabayu, N.; Harun, M. S.; Pallu; Achmad, A.","","","Statistic Approach versus Artificial Intelligence for Rainfall Prediction Based on Data Series","","","ResearchGate","5","2","1962","1969","","","Apr.",2013,"","","","",1
"100","A100","J","Irina, R.; Joseph, H.; Jayram, T.","","","An analysis of data characteristics that affect naive Bayes performance","","","ResearchGate","","","","","","","",2001,"","","","",1
"101","A101","J","Iryanto, I.; Hermawan; Syakur, A.","","","Studi Pengaruh Penuaan (Aging) Terhadap Laju Degradasi Kualitas Minyak Isolasi Transformator Tenaga","","","ResearchGate","","","","","","","Januari",2016,"","","","",1
"102","A102","J","Jagannathan, L; Cuddapah, S; Costa, M","","","Oxidative stress under ambient and physiological oxygen tension in tissue culture","","","ResearchGate.","","","","","","DOI 10.1007/S40495-016-0050-5","",2016,"","","","",1
"103","A103","J","Jaiswal, M; Gandhi, A; Sharma, A; Mittal, SR","","","Spectrum of complex non-missile penetrating spinal injury: a series of four cases with review of literature","","","ResearchGate","5","","25","34","","","",2014,"","","","",1
"104","A104","J","Jakobek, L.; Seruga, M.; Novak, I.; Medvidovic-Kosanovic, M.","","","","","","Research Gate","103","","1","1","","","",2007,"","","","",1
"105","A105","J","Jezerek, M.; Flear, M.; Moina, J.","","","Laser multiple line triangulation system for real-time 3-D monitoring of chest wall during breathing","","","ResearchGate","54","7","","","503506","","Jan.",2008,"","","","",1
"106","A106","J","Johansson, G; Winroth, M","","","Lean vs. Green manufacturing: similarities and differences","","","ResearchGate","","","","","","","",2009,"16th International Annual EurOMA Conference: Implementation-Realizing Operations Management Knowledge","","","",1
"107","A107","J","Kao, K. L.","","","An advanced simulation tool- set for video transmission performance evaluation","","","ResearchGate","","","","","","DOI 10.1145/1190455.1190464","",2006,"","","","",1
"108","A108","J","Karimov, K. S.; Khalid, F. A.; Chani, M. T. S.; Mateen, A.; Hussain, M. A.; Maqbool, A.","","","Carbon nanotubes based flexible temperature sensors","","","ResearchGate","6","1","","","","","",NA,"","","","",1
"109","A109","J","Kelly, O. D.; Anane, A.; Bernard, R.; Youssef, J. B.; Hahn, C.; Molpeceres, A.-H.; Carretero, C.; Jacquet, E.; Deranlot, C.; Bortolotti, P.; Lebourgois, R.; Mage, J.-C.; Loubens, G. de; Klein, O.; Cros, V.; Fert, A.","","","","","","ResearchGate","","","","","","","",2013,"","","","",1
"110","A110","J","Kelsey, J.; Schneier, B.; Wagner, D.","","","Related-key cryptanalysis of 3-way,biham-des,cast, des-x, newdes, rc2, and tea","","","ResearchGate","","","","","","","",2000,"","","","",1
"111","A111","J","Kharisov, B. I.","","","Dispersion of carbon nanotubes in water and non-aqueous solvents","","","ResearchGate","","","","","","","",NA,"","","","",1
"112","A112","J","Khitun, A.; Nikonov, D. E.; Bao, M.; Galatsis, K.; Wang, K. L.","","","","","","ResearchGate","","","","","","","",2007,"","","","",1
"113","A113","J","Kim, S. M.; Chong, J. W.; Jung, C. Y.; Jeon, T. H.; Park, J. H.; Kang, Y. J.; Jeong, S. H.; Kim, M. J.; Sung, D. K.","","","Experiments on Interference and Coexistence between ZigBee and WLAN Devices Operating in the 2.4 GHz ISM Band","","","ResearchGate","1","","","","","","",2005,"","","","",1
"114","A114","J","Kincaid, RL","","","Assessment of trace mineral status of ruminants: a review","","","ResearchGate","","","77","77","","","",1999,"","","","",1
"115","A115","J","Kleimola, J.","","","A RESTful Interface to a Mobile Phone","","","ResearchGate","","","","","","","",2008,"","","","",1
"116","A116","J","Klein, D.","","","An OpenFlow extension for the OMNeT++ INET framework","","","ResearchGate","","","","","","","",2013,"","","","",1
"117","A117","J","Kleinberg, S. C.; Arroyo, J. E.; Chih, K.; Scherer, S. S.","","","Na, K-ATPase isoforms in the PNS: Cell-type specific expression and internodal localization inmyelinated axons","","","ResearchGate","","","","","","","",2007,"","","","",1
"118","A118","J","Knudsen, M. P.; Dalum, B.; Villumsen, G.","","","","","","Two Faces of Absorptive Capacity Creation: Access and Utilisation of Knowledge","","","","","","","",2001,"","","","",1
"119","A119","J","Koch, D.; Buchan, W.; Cnop, T.; Antwerp, U.","","","Proper Pretreatment Systems Reduce Membrane Replacement Element Costs and Improve Reliability","","","ResearchGate","","","","","","","",2005,"","","","",1
"120","A120","J","Kolobukhina, LV; Nosik, NN; Merkulova, LN","","","Time course of leukocyte interferon induction after single and repeated application of panavir","","","ResearchGate","8","","49","52","","","",2009,"","","","",1
"121","A121","J","Kumar, G.; Brar, S.; Kumar, R.; Kumar, A.","","","A review: DWT-DCT technique and arithmetic-Huffman coding based image compression","","","ResearchGate","","","1","14","","","",2015,"","","","",1
"122","A122","J","Kviesis-Kipge, E.; Curkste, E.; Spigulis, J.; Eihvalde, L.","","","","","","ResearchGate","7715","","2010","2010","","","",2010,"","","","",1
"123","A123","J","","","","Strukturmodell des Rezeptors","","","ResearchGate","","","","","","","",2014,"","","","",1
"124","A124","J","Lampel, J.; Mintzberg, H.","","","Customizing Customization","","","ResearchGate","","","21","30","","","",1996,"","","","",1
